{
  "$schema": "https://json-schema.org/draft/2020-12/schema",
  "$id": "contracts/regime_strategy_brief_trace_diff.schema.v1.json",
  "title": "RegimeStrategyBriefTraceDiff",
  "type": "object",
  "additionalProperties": false,
  "required": ["schema_version", "left", "right", "inputs_hash", "changes", "coverage_delta"],
  "properties": {
    "schema_version": { "type": "integer", "const": 1 },
    "left": {
      "type": "object",
      "additionalProperties": false,
      "required": ["as_of", "inputs_hash", "normalized_trace_hash", "artifacts"],
      "properties": {
        "as_of": { "type": "string", "pattern": "^\\d{4}-\\d{2}-\\d{2}$" },
        "inputs_hash": { "type": "string", "pattern": "^[a-f0-9]{64}$" },
        "normalized_trace_hash": { "type": "string", "pattern": "^[a-f0-9]{64}$" },
        "artifacts": {
          "type": "object",
          "additionalProperties": false,
          "required": ["brief", "earnings", "catalysts", "strategy", "markdown"],
          "properties": {
            "brief": {
              "type": "object",
              "additionalProperties": false,
              "required": ["normalized_brief_hash"],
              "properties": {
                "normalized_brief_hash": { "type": "string", "pattern": "^[a-f0-9]{64}$" }
              }
            },
            "earnings": {
              "type": "object",
              "additionalProperties": false,
              "required": ["normalized_jsonl_hash"],
              "properties": {
                "normalized_jsonl_hash": { "type": "string", "pattern": "^[a-f0-9]{64}$" }
              }
            },
            "catalysts": {
              "type": "object",
              "additionalProperties": false,
              "required": ["normalized_jsonl_hash"],
              "properties": {
                "normalized_jsonl_hash": { "type": "string", "pattern": "^[a-f0-9]{64}$" }
              }
            },
            "strategy": {
              "type": "object",
              "additionalProperties": false,
              "required": ["normalized_strategy_hash"],
              "properties": {
                "normalized_strategy_hash": { "type": "string", "pattern": "^[a-f0-9]{64}$" }
              }
            },
            "markdown": {
              "type": "object",
              "additionalProperties": false,
              "required": ["markdown_hash"],
              "properties": {
                "markdown_hash": { "type": ["string", "null"], "pattern": "^[a-f0-9]{64}$" }
              }
            }
          }
        }
      }
    },
    "right": {
      "type": "object",
      "additionalProperties": false,
      "required": ["as_of", "inputs_hash", "normalized_trace_hash", "artifacts"],
      "properties": {
        "as_of": { "type": "string", "pattern": "^\\d{4}-\\d{2}-\\d{2}$" },
        "inputs_hash": { "type": "string", "pattern": "^[a-f0-9]{64}$" },
        "normalized_trace_hash": { "type": "string", "pattern": "^[a-f0-9]{64}$" },
        "artifacts": {
          "type": "object",
          "additionalProperties": false,
          "required": ["brief", "earnings", "catalysts", "strategy", "markdown"],
          "properties": {
            "brief": {
              "type": "object",
              "additionalProperties": false,
              "required": ["normalized_brief_hash"],
              "properties": {
                "normalized_brief_hash": { "type": "string", "pattern": "^[a-f0-9]{64}$" }
              }
            },
            "earnings": {
              "type": "object",
              "additionalProperties": false,
              "required": ["normalized_jsonl_hash"],
              "properties": {
                "normalized_jsonl_hash": { "type": "string", "pattern": "^[a-f0-9]{64}$" }
              }
            },
            "catalysts": {
              "type": "object",
              "additionalProperties": false,
              "required": ["normalized_jsonl_hash"],
              "properties": {
                "normalized_jsonl_hash": { "type": "string", "pattern": "^[a-f0-9]{64}$" }
              }
            },
            "strategy": {
              "type": "object",
              "additionalProperties": false,
              "required": ["normalized_strategy_hash"],
              "properties": {
                "normalized_strategy_hash": { "type": "string", "pattern": "^[a-f0-9]{64}$" }
              }
            },
            "markdown": {
              "type": "object",
              "additionalProperties": false,
              "required": ["markdown_hash"],
              "properties": {
                "markdown_hash": { "type": ["string", "null"], "pattern": "^[a-f0-9]{64}$" }
              }
            }
          }
        }
      }
    },
    "inputs_hash": { "type": "string", "pattern": "^[a-f0-9]{64}$" },
    "changes": {
      "type": "object",
      "additionalProperties": false,
      "required": [
        "as_of_changed",
        "brief_changed",
        "earnings_changed",
        "catalysts_changed",
        "strategy_changed",
        "markdown_changed",
        "trace_changed"
      ],
      "properties": {
        "as_of_changed": { "type": "boolean" },
        "brief_changed": { "type": "boolean" },
        "earnings_changed": { "type": "boolean" },
        "catalysts_changed": { "type": "boolean" },
        "strategy_changed": { "type": "boolean" },
        "markdown_changed": { "type": "boolean" },
        "trace_changed": { "type": "boolean" }
      }
    },
    "coverage_delta": {
      "type": "object",
      "additionalProperties": false,
      "required": [
        "signals_rows_delta",
        "playbook_watchlist_delta",
        "playbook_event_risk_delta",
        "playbook_momentum_delta"
      ],
      "properties": {
        "signals_rows_delta": { "type": "integer" },
        "playbook_watchlist_delta": { "type": "integer" },
        "playbook_event_risk_delta": { "type": "integer" },
        "playbook_momentum_delta": { "type": "integer" }
      }
    }
  }
}
